{"schema_version":"axignal.security-identity-rights-registry/v0.1","task_id":"AX-GE2E-P03-T01","programme_version":"1.4.0","status":"DRAFT_ENGINEERING_FOUNDATION","human_authorised_branch_start":true,"canonical_activation_authorised":false,"dependency_status":{"p02_task":"AX-GE2E-P02-T01","p02_engineering_head":"1800d5e7944e49cb85f52abeb9c1ce51af666d08","p02_engineering_evidence_ready":true,"p02_canonical_activation_authorised":false,"p01_dependency_satisfied":false,"stacked_base_branch":"agent/ax-ge2e-p02-global-ontology-contracts-v1.4","merge_to_main_allowed":false},"trust_principles":["Deny by default and fail closed on missing, stale, ambiguous or conflicting authority.","Authentication proves a principal; it never selects tenant, workspace, role or capability.","Tenant and workspace authority are resolved exclusively by trusted server-side policy.","Every authorization decision is scoped to principal, action, resource, tenant, workspace, purpose, data class and source-rights state.","Roles are templates only; effective authority is the intersection of active bindings and explicit capabilities.","The browser, model output and worker payloads cannot grant or widen authority.","Row-level security is mandatory defence in depth and does not replace service-layer authorization.","Unknown data classification or source rights default to RESTRICTED.","Exports require explicit rights, purpose, destination, scope, manifest and auditable authorization.","Revocation and kill switches take precedence over cached decisions and in-flight convenience.","Break-glass access is exceptional, time-bounded, independently approved and fully audited.","Security events preserve non-repudiation without recording secrets or unnecessary personal data."],"identity_contract":{"principal_types":["HUMAN_USER","SERVICE_PRINCIPAL","WORKLOAD_IDENTITY","BREAK_GLASS_PRINCIPAL"],"authentication_assurance_levels":["AAL1","AAL2","AAL3"],"required_fields":["principal_id","principal_type","issuer","subject","status","assurance_level","authenticated_at","session_id","credential_version","created_at","revoked_at"],"status_values":["PENDING","ACTIVE","SUSPENDED","REVOKED","EXPIRED"],"rules":["Principal identifiers are opaque, immutable and unique within the trusted issuer.","Email addresses, display names and model-provided identifiers are never authorization keys.","Service and workload identities have no interactive session or organisation-owner privileges.","Credential rotation increments credential_version and invalidates older sessions.","A suspended, revoked or expired principal contributes zero capabilities."]},"organisation_contract":{"resource_types":["ORGANISATION","TENANT","WORKSPACE"],"required_fields":["organisation_id","tenant_id","workspace_id","status","data_region","policy_version","created_at","suspended_at","closed_at"],"status_values":["PROVISIONING","ACTIVE","SUSPENDED","CLOSED"],"rules":["Organisation, tenant and workspace are distinct resources and are never inferred from client-supplied identifiers.","Every tenant belongs to exactly one organisation; every workspace belongs to exactly one tenant.","Suspension of an organisation, tenant or workspace denies new access and export decisions.","Cross-tenant operations require an explicit platform capability and never reuse tenant-local roles."]},"membership_contract":{"required_fields":["membership_id","principal_id","organisation_id","tenant_id","workspace_scope","role_binding_ids","status","valid_from","valid_to","granted_by","grant_reason","policy_version"],"status_values":["INVITED","ACTIVE","SUSPENDED","REVOKED","EXPIRED"],"rules":["Membership is explicit, time-bounded and independently revocable.","Invited, suspended, revoked or expired membership contributes zero capabilities.","Organisation membership does not imply access to every tenant or workspace.","Membership updates invalidate cached authorization decisions immediately."]},"authorization_contract":{"decision_states":["ALLOW","DENY","NOT_APPLICABLE","INDETERMINATE"],"default_decision":"DENY","required_inputs":["principal_id","session_id","action","resource_type","resource_id","organisation_id","tenant_id","workspace_id","purpose","data_classification","source_rights_snapshot_ids","policy_version","request_time"],"capabilities":["organisation:read","organisation:manage","membership:manage","security:manage","rights:review","research:read","research:create","research:review","evidence:read","claim:read","export:create","export:approve","audit:read","service:execute","billing:manage"],"role_templates":[{"role_id":"ORG_OWNER","capabilities":["organisation:read","organisation:manage","membership:manage","security:manage","billing:manage"]},{"role_id":"ORG_ADMIN","capabilities":["organisation:read","membership:manage"]},{"role_id":"SECURITY_ADMIN","capabilities":["security:manage","audit:read"]},{"role_id":"RIGHTS_STEWARD","capabilities":["rights:review","audit:read"]},{"role_id":"RESEARCH_OPERATOR","capabilities":["research:read","research:create","evidence:read","claim:read"]},{"role_id":"REVIEWER","capabilities":["research:read","research:review","evidence:read","claim:read"]},{"role_id":"EXPORT_OPERATOR","capabilities":["research:read","evidence:read","claim:read","export:create"]},{"role_id":"EXPORT_APPROVER","capabilities":["research:read","export:approve","audit:read"]},{"role_id":"AUDITOR","capabilities":["audit:read"]},{"role_id":"SERVICE_WORKER","capabilities":["service:execute"]}],"separation_of_duties":["For RESTRICTED or flagged data, export:create and export:approve must be exercised by different human principals.","A principal cannot approve its own break-glass grant.","SERVICE_WORKER cannot receive membership:manage, security:manage, rights:review, export:approve or billing:manage.","RIGHTS_STEWARD review cannot be substituted by a model, parser or source connector."],"rules":["Effective capabilities are the intersection of active principal, session, membership, role binding, resource scope and policy.","Client-supplied roles, capabilities, tenant IDs, workspace IDs and policy decisions are ignored.","Model output, tool output and worker payloads cannot create membership, role bindings or capabilities.","INDETERMINATE is treated as DENY at every enforcement point.","Resource non-disclosure returns the same external result for unknown and foreign resources."]},"session_contract":{"cookie_requirements":["Secure","HttpOnly","SameSite=Strict","Path=/"],"required_controls":["opaque_server_session","rotation_after_authentication","rotation_after_privilege_change","idle_timeout","absolute_timeout","csrf_protection","replay_detection","credential_version_binding","revocation_check"],"rules":["Bearer credentials and session identifiers never appear in URLs, logs or browser-readable storage.","Privilege changes and credential rotation invalidate prior sessions.","Session context cannot override server-resolved organisation, tenant, workspace or capabilities.","Sensitive actions require recent authentication at the policy-defined assurance level."]},"rls_contract":{"scope_columns":["tenant_id","workspace_id"],"required_controls":["ENABLE_ROW_LEVEL_SECURITY","FORCE_ROW_LEVEL_SECURITY","SELECT_POLICY","INSERT_WITH_CHECK","UPDATE_USING_AND_WITH_CHECK","DELETE_POLICY","NO_BYPASSRLS_APPLICATION_ROLE","SAFE_SECURITY_DEFINER","TRANSACTION_LOCAL_CONTEXT","TABLE_OWNER_NOT_RUNTIME_ROLE"],"trusted_context_keys":["app.principal_id","app.organisation_id","app.tenant_id","app.workspace_id","app.policy_version","app.request_id"],"rules":["RLS context is set with transaction-local server values after authorization and before data access.","Browser headers, query parameters, cookies and model output cannot set trusted database context.","Application roles do not own protected tables and do not possess BYPASSRLS.","SECURITY DEFINER functions pin search_path, validate scope and expose only the minimum operation.","Missing or malformed RLS context yields zero visible or mutable rows."]},"data_classification_contract":{"confidentiality_levels":["PUBLIC","INTERNAL","CONFIDENTIAL","RESTRICTED"],"content_flags":["PERSONAL","SENSITIVE_PERSONAL","SECRET","SOURCE_RESTRICTED","LICENSED","EXPORT_CONTROLLED"],"default_when_unknown":"RESTRICTED","required_fields":["classification_id","confidentiality_level","content_flags","classified_by","method","policy_version","valid_from","review_due_at","replacement_ref"],"rules":["Classification is attached to source objects, evidence, claims, documents, exports and audit payloads.","Automated classification may propose but cannot lower an existing classification without human authority.","Secrets are never persisted in evidence, claims, exports or ordinary audit payloads.","Personal-data minimisation and purpose limitation apply independently from confidentiality."]},"source_rights_enforcement_contract":{"required_rights_dimensions":["collection","transient_processing","persistent_storage","model_input","derived_calculations","internal_display","customer_display","export","api_redistribution","model_training_or_evaluation"],"decision_inputs":["source_id","source_version","rights_snapshot_id","source_state","kill_switch","requested_action","purpose","destination","retention_rule","attribution_requirements"],"rules":["The P02 source-rights snapshot is mandatory and version-pinned for every protected action.","Ambiguous, missing, expired, suspended, revoked or conflicting rights deny the affected action.","Technical accessibility never overrides rights, retention, attribution or redistribution restrictions.","Kill-switch activation invalidates cached allow decisions and blocks new materialisation or export.","Derived claims do not inherit export or redistribution rights unless explicitly authorised."]},"export_contract":{"states":["REQUESTED","POLICY_EVALUATED","APPROVAL_REQUIRED","APPROVED","MATERIALISED","DELIVERED","REVOKED","EXPIRED","REJECTED"],"required_fields":["export_id","requesting_principal_id","app